<?xml version="1.0" encoding="UTF-8"?>
<includeSection xmlns="http://arachne.uni-koeln.de/schemas/include"
	xmlns:xsi="http://www.w3.org/2001/XMLSchema-instance"
	xsi:schemaLocation="http://arachne.uni-koeln.de/schemas/include include.xsd">
	<context type="buch" labelKey="Literatur in Arachne" link="">
		<field datasource=".contextUri" prefix="$link$" />
		<field datasource=".BuchTitel">
			<ifEmpty>
				<field datasource="zenon.245_a">
					<ifEmpty>
						<field datasource=".KurzbeschreibungBuch" />
					</ifEmpty>
				</field>
			</ifEmpty>
		</field>
	</context>
</includeSection>