<?xml version="1.0" encoding="UTF-8"?>
<!--
  CeramEgypt Objects 2.0
  description of special treatments to the surface

  <context type="surface" labelKey="Surface Treatments">
        <contextSection>
            <subtitle separator="|||">
              <field prefix="Treatment: " datasource=".surfacetreatment.Bezeichner" />
              <field prefix="Puff: " datasource="surfacetreatment.Bezeichner" />
            </subtitle>
            <field prefix="STID:" datasource=".surfacetreatment.PS_surfaceTreatmentID" />
            <field prefix="STDG:" datasource=".surfacetreatment.DatensatzGruppeSurfacetreatment" />
            <subcontext type="surfacetreatmentaction">
              <field prefix="Action: " datasource=".TreatmentAction" />
              <field prefix="Position: " datasource=".TreatmentPosition" />
              <field prefix="FreeDescription: " datasource=".FreeDescription" />
            </subcontext>
        </contextSection>
      </context>

-->
<includeSection xmlns="http://arachne.uni-koeln.de/schemas/include" xmlns:xsi="http://www.w3.org/2001/XMLSchema-instance" xsi:schemaLocation="http://arachne.uni-koeln.de/schemas/include include.xsd">

    <context type="surface" labelKey="Oberflächenbehandlungen">
        <contextSection>
            <subtitle>
                <field datasource="surfacetreatment.Bezeichner" />
            </subtitle>

            <subcontext type="surfacetreatmentaction">

                <field prefix="[" postfix="]" datasource=".TreatmentAction"/>

                <field prefix="Spezielle Überzugstechnik: " datasource=".TreatmentActionSubCoating" />
                <field prefix="Beschreibung der Einkerbung: " datasource=".IncisionDescription" />
                <field prefix="Stempel: " datasource=".StampedStamp" />
                <field prefix="Art des hinzugefügten Materials: " datasource=".AddedMaterialType" />

                <field prefix="Zeitpunkt der Oberflächenbehandlung: " datasource=".MomentOfSurfaceTreatmentAction" />
                <field prefix="Position der Oberflächenbehandlung: " datasource=".TreatmentPosition" />
                <field prefix="Behandelter Teil der Oberfläche: " datasource=".PartOfSurfaceTreated" />
                <field prefix="Zustand: " datasource=".Condition" />
                <field prefix="Anzahl vorhandener Fragmente mit dieser Oberflächenbehandlung: " datasource=".NumberOfSherds" />

                <field prefix="Dicke: " datasource=".Thickness" />
                <field prefix="Glanz: " datasource=".Glossiness" />
                <field prefix="Erhaltung: " datasource=".Conservation" />
                <field prefix="Qualität: " datasource=".Quality" />
                <field prefix="Homogenität: " datasource=".Homogenity" />
                <field prefix="Anhaftung: " datasource=".Adherence" />
                <field prefix="Ausrichtung: " datasource=".Alignment" />
                <field prefix="Freie Beschreibung: " datasource=".FreeDescription" />
            </subcontext>
        </contextSection>
    </context>

</includeSection>