<?xml version="1.0" encoding="UTF-8"?>
<includeSection xmlns="http://arachne.uni-koeln.de/schemas/include" xmlns:xsi="http://www.w3.org/2001/XMLSchema-instance" xsi:schemaLocation="http://arachne.uni-koeln.de/schemas/include include.xsd">
  <context type="literaturcomplete" labelKey="Literatur" separator=", ">
    <field datasource=".arachneLinkStart" separator="" />
	<field datasource=".tempLiteratur" />
	<field datasource=".Abkuerzungen">
		<ifEmpty>
			<field datasource=".DAIRichtlinien" />
		</ifEmpty>
	</field>
	<field datasource=".Corpuszitat" />
	<field datasource=".AntikeTextquelle" />
	<field datasource=".Seite" />
	<field datasource=".Anmerkung" prefix="Anm. " />
	<!-- AdditionalInfosJSON -->
	<field datasource=".Abbildung" prefix="Abb. " />
	<!-- AdditionalInfosJSON -->
    <field datasource=".Katnummer" prefix="Kat.Nr. " />
    <!-- AdditionalInfosJSON -->
    <field datasource=".Tafel" prefix="Taf. " />
    <!-- AdditionalInfosJSON -->
    <field datasource=".Figur" prefix="Fig. " />
    <!-- AdditionalInfosJSON -->
    <field datasource=".Beilage" prefix="Beil. " />
    <!-- AdditionalInfosJSON -->
    <field datasource=".subVoce" prefix="s.v. " />
    <!-- AdditionalInfosJSON -->
    <field datasource=".Textauszug" prefix="[Textauszug: '" postfix="']" />
    <!-- AdditionalInfosJSON -->
    <field datasource=".TextauszugUebersetzung" prefix="[Übersetzter Textauszug: '" postfix="']" />
    <!-- AdditionalInfosJSON -->
    <field datasource=".KommentarLitZitat" prefix="(" postfix=")" />
    <field datasource=".Supplement" prefix="Supplement: " />
    <!-- AdditionalInfosJSON -->
    <field datasource=".arachneLinkEnd" overrideSeparator="" separator=" " />
    <linkField labelKey="Online verfügbar" datasource=".Onlinequelle" overrideSeparator=" "/>
    <linkField labelKey="Zenon" datasource=".ZenonID" prefix="https://zenon.dainst.org/Record/" overrideSeparator=" " />
  </context>
</includeSection>
