<?xml version="1.0" encoding="UTF-8"?>
<includeSection xmlns="http://arachne.uni-koeln.de/schemas/include" xmlns:xsi="http://www.w3.org/2001/XMLSchema-instance" xsi:schemaLocation="http://arachne.uni-koeln.de/schemas/include include.xsd">
    <context type="personcomplete" labelKey="Personen und Sammler" separator=" ">
        <field datasource=".arachneLinkStart" separator="" />
        <field datasource=".Sammlerreihenfolge" postfix=".)"/>
        <field datasource=".Titel"/>
        <field datasource=".VornameSonst"/>
        <field datasource=".Namenszusatz"/>
        <field datasource=".FamVatersnameSonst"/>
        <field datasource=".Cognomen"/>
        <field datasource=".Kurzbeschreibung" prefix=" - "/>
        <field datasource=".Verwandtschaftsverhaeltnis" prefix=" - "/>
        <field datasource=".arachneLinkEnd" overrideSeparator="" separator=" " />
    </context>
</includeSection>